{
  "schemaVersion": 2,
  "revision": 5,
  "campaignId": "teachers_day_2026_v1",
  "name": "Teachers' Day",
  "enabled": true,
  "startsAt": "2026-10-01T00:00:00+05:30",
  "endsAt": "2026-12-31T23:59:59+05:30",
  "minAppBuild": 48,
  "theme": {
    "background": "#FBF7EC",
    "surface": "#F3ECD9",
    "surfaceElevated": "#FFFFFF",
    "header": "#152159",
    "accent": "#E0A417",
    "accentSecondary": "#A8324A",
    "title": "#152159",
    "body": "#2A2A2A",
    "mutedText": "#5A6488",
    "divider": "#E5DCC4",
    "heroGradientStart": "#14204F",
    "heroGradientEnd": "#6A4FA3",
    "ctaBackground": "#152159",
    "ctaForeground": "#FFD75A",
    "badgeBackground": "#E0A417",
    "badgeForeground": "#2A1C00"
  },
  "sponsor": {
    "enabled": true,
    "label": "POWERED BY",
    "name": "HATO",
    "logoUrl": null,
    "disclosure": "Sponsored"
  },
  "assetBaseUrl": "https://raw.githubusercontent.com/metavisionrs/hato-festival-config/main/assets/",
  "sections": {
    "home": {
      "enabled": true,
      "url": "https://raw.githubusercontent.com/metavisionrs/hato-festival-config/main/sections/home.json"
    },
    "food": {
      "enabled": false,
      "url": "https://raw.githubusercontent.com/metavisionrs/hato-festival-config/main/sections/teachers/food.json"
    },
    "grocery": {
      "enabled": false,
      "url": "https://raw.githubusercontent.com/metavisionrs/hato-festival-config/main/sections/teachers/grocery.json"
    },
    "ride": {
      "enabled": false,
      "url": "https://raw.githubusercontent.com/metavisionrs/hato-festival-config/main/sections/teachers/ride.json"
    },
    "parcel": {
      "enabled": false,
      "url": "https://raw.githubusercontent.com/metavisionrs/hato-festival-config/main/sections/teachers/parcel.json"
    },
    "carpool": {
      "enabled": false,
      "url": "https://raw.githubusercontent.com/metavisionrs/hato-festival-config/main/sections/teachers/carpool.json"
    }
  }
}
